{
  "schema_version": 1,
  "id": "EV-5cf989e36ba94497b3a5f462a6db1f59",
  "change_id": "CHG-008",
  "check_id": "CHK-ACCEPT",
  "kind": "automated",
  "result": "pass",
  "observed_at": "2026-09-08T16:36:22.462356+00:00",
  "expires_at": "2026-09-15T16:36:22.462356+00:00",
  "contract_hash": "1c449da9872cf42f6b5a30eccc2952f8e776f43208790dcb1b6075d0172a030d",
  "source_hash": "31995e27f2a0bc72e924651e83f8e5eef224b3477b6973707a1bb4b8477a322a",
  "observer": "chatgpt-work-final-source",
  "argv": [
    "python3",
    "-m",
    "unittest",
    "discover",
    "-s",
    "tests",
    "-p",
    "test_review_health.py",
    "-v"
  ],
  "exit_code": 0,
  "output_hash": "5e69b10d542a14459c3463dba97caad462e39942c5f3efa5c5592f5c5d0314f5",
  "output_bytes": 1475,
  "artifact": "",
  "artifact_hash": "",
  "notes": "",
  "environment": "Linux x86_64; Python 3.12.13",
  "trust": "local-untrusted"
}
