{
  "schema_version": 1,
  "id": "EV-b206fdac55724bce86c3b1965c6e4c64",
  "change_id": "CHG-006",
  "check_id": "CHK-ACCEPT",
  "kind": "automated",
  "result": "pass",
  "observed_at": "2026-09-08T20:21:36.288058+00:00",
  "expires_at": "2026-09-15T20:21:36.288058+00:00",
  "contract_hash": "8dc3aa7c1b72d46600ba02ce7eacd3e226b93221b39bd8691d66c94eb7a72c52",
  "source_hash": "31995e27f2a0bc72e924651e83f8e5eef224b3477b6973707a1bb4b8477a322a",
  "observer": "chatgpt-work",
  "argv": [
    "python3",
    "-m",
    "unittest",
    "discover",
    "-s",
    "tests",
    "-p",
    "test_install_check.py",
    "-v"
  ],
  "exit_code": 0,
  "output_hash": "3fd8496412416084632abc2baf93178d7d386ead434537506548f2a1242584ba",
  "output_bytes": 1600,
  "artifact": "",
  "artifact_hash": "",
  "notes": "",
  "environment": "Linux x86_64; Python 3.12.13",
  "trust": "local-untrusted"
}
