{
  "schema_version": 1,
  "id": "EV-d2f03516eb6e474ba904899069052305",
  "change_id": "CHG-008",
  "check_id": "CHK-OPS",
  "kind": "manual",
  "result": "pass",
  "observed_at": "2026-09-08T16:32:14.604696+00:00",
  "expires_at": "2026-09-15T16:32:14.604696+00:00",
  "contract_hash": "1c449da9872cf42f6b5a30eccc2952f8e776f43208790dcb1b6075d0172a030d",
  "source_hash": "36411e1942e0fc2999565e0f4852d896df0ddd4e879d6778fa4cbf3fe8ceaaf7",
  "observer": "chatgpt-work",
  "argv": [],
  "exit_code": -1,
  "output_hash": "",
  "output_bytes": 0,
  "artifact": ".spec-loop/artifacts/health-result.json",
  "artifact_hash": "e2ad81bdd4b28e3d7890845b3493bf5eb854f584143913f734530cfaf9e2f24a",
  "notes": "Live MCP report at 16:27 UTC separated actual schedule, current main push and installed bundle. Native context resumed. Evidence is historical after its freshness window; human outcome remains missing.",
  "environment": "Linux x86_64; Python 3.12.13",
  "trust": "local-untrusted"
}
