{
  "schema_version": 1,
  "id": "EV-c4dfa53666b44a049483c1553abf4abc",
  "change_id": "CHG-HOST",
  "check_id": "CHK-RELEASE",
  "kind": "manual",
  "result": "pass",
  "observed_at": "2026-09-08T20:41:48.488880+00:00",
  "expires_at": "2026-09-15T20:41:48.488880+00:00",
  "contract_hash": "0092df36623c9e750779be69c5ffc203b7953e037b38956636e0262d3ff5eda8",
  "source_hash": "31995e27f2a0bc72e924651e83f8e5eef224b3477b6973707a1bb4b8477a322a",
  "observer": "chatgpt-work-with-user-confirmation",
  "argv": [],
  "exit_code": -1,
  "output_hash": "",
  "output_bytes": 0,
  "artifact": ".spec-loop/artifacts/host-user-confirmation-2026-09-08.md",
  "artifact_hash": "23c8905bd46ca7ce2a4ca41e7d94ade780bbaadf789eaa319b68f0bcab692ebd",
  "notes": "Observed installed Work resources and use, together with the checked v0.8 package build, extraction and recovery. Scope and archive digest are recorded; no new deployment.",
  "environment": "Linux x86_64; Python 3.12.13",
  "trust": "local-untrusted"
}
